"GEO_ID","NAME","B25001_001E","B25001_001M",
"Geography","Geographic Area Name","Estimate!!Total","Margin of Error!!Total",
"310M200US10140","Aberdeen, WA Micro Area","35300","329",
"310M200US10180","Abilene, TX Metro Area","70595","1112",
"310M200US10300","Adrian, MI Micro Area","43449","424",
"310M200US10380","Aguadilla-Isabela, PR Metro Area","146720","2683",
"310M200US10420","Akron, OH Metro Area","313518","942",
"310M200US10460","Alamogordo, NM Micro Area","30925","436",
"310M200US10500","Albany, GA Metro Area","66857","1011",
"310M200US10540","Albany, OR Metro Area","49174","240",
"310M200US10580","Albany-Schenectady-Troy, NY Metro Area","398555","914",
"310M200US10700","Albertville, AL Micro Area","40324","142",
"310M200US10740","Albuquerque, NM Metro Area","381558","1295",
"310M200US10780","Alexandria, LA Metro Area","66402","496",
"310M200US10900","Allentown-Bethlehem-Easton, PA-NJ Metro Area","345251","1056",
"310M200US11020","Altoona, PA Metro Area","56007","384",
"310M200US11100","Amarillo, TX Metro Area","107954","731",
"310M200US11180","Ames, IA Metro Area","38558","944",
"310M200US11260","Anchorage, AK Metro Area","156279","446",
"310M200US11460","Ann Arbor, MI Metro Area","150083","937",
"310M200US11500","Anniston-Oxford-Jacksonville, AL Metro Area","53323","404",
"310M200US11540","Appleton, WI Metro Area","95890","312",
"310M200US11640","Arecibo, PR Metro Area","83366","1763",
"310M200US11700","Asheville, NC Metro Area","218917","1185",
"310M200US11780","Ashtabula, OH Micro Area","45817","283",
"310M200US11900","Athens, OH Micro Area","26210","468",
"310M200US11980","Athens, TX Micro Area","40114","214",
"310M200US12020","Athens-Clarke County, GA Metro Area","84691","1141",
"310M200US12060","Atlanta-Sandy Springs-Roswell, GA Metro Area","2240042","2726",
"310M200US12100","Atlantic City-Hammonton, NJ Metro Area","127879","414",
"310M200US12180","Auburn, NY Micro Area","36463","500",
"310M200US12220","Auburn-Opelika, AL Metro Area","66385","376",
"310M200US12260","Augusta-Richmond County, GA-SC Metro Area","250529","1836",
"310M200US12300","Augusta-Waterville, ME Micro Area","61683","291",
"310M200US12420","Austin-Round Rock, TX Metro Area","784417","2557",
"310M200US12540","Bakersfield, CA Metro Area","293589","1023",
"310M200US12580","Baltimore-Columbia-Towson, MD Metro Area","1155452","1106",
"310M200US12620","Bangor, ME Metro Area","74332","420",
"310M200US12700","Barnstable Town, MA Metro Area","162116","368",
"310M200US12940","Baton Rouge, LA Metro Area","345319","946",
"310M200US12980","Battle Creek, MI Metro Area","60608","395",
"310M200US13020","Bay City, MI Metro Area","47964","244",
"310M200US13140","Beaumont-Port Arthur, TX Metro Area","175086","1410",
"310M200US13180","Beaver Dam, WI Micro Area","37401","401",
"310M200US13220","Beckley, WV Metro Area","57522","498",
"310M200US13380","Bellingham, WA Metro Area","93263","465",
"310M200US13460","Bend-Redmond, OR Metro Area","83886","236",
"310M200US13740","Billings, MT Metro Area","74707","580",
"310M200US13780","Binghamton, NY Metro Area","111816","608",
"310M200US13820","Birmingham-Hoover, AL Metro Area","510137","1476",
"310M200US13900","Bismarck, ND Metro Area","58103","487",
"310M200US13980","Blacksburg-Christiansburg-Radford, VA Metro Area","79371","1701",
"310M200US14010","Bloomington, IL Metro Area","78827","593",
"310M200US14020","Bloomington, IN Metro Area","70027","1283",
"310M200US14100","Bloomsburg-Berwick, PA Metro Area","37647","595",
"310M200US14140","Bluefield, WV-VA Micro Area","50434","232",
"310M200US14260","Boise City, ID Metro Area","260644","1623",
"310M200US14460","Boston-Cambridge-Newton, MA-NH Metro Area","1917372","1716",
"310M200US14500","Boulder, CO Metro Area","132448","782",
"310M200US14540","Bowling Green, KY Metro Area","71676","1271",
"310M200US14580","Bozeman, MT Micro Area","45969","346",
"310M200US14660","Brainerd, MN Micro Area","66530","213",
"310M200US14700","Branson, MO Micro Area","50766","268",
"310M200US14740","Bremerton-Silverdale, WA Metro Area","109684","471",
"310M200US14860","Bridgeport-Stamford-Norwalk, CT Metro Area","366129","766",
"310M200US15180","Brownsville-Harlingen, TX Metro Area","147515","470",
"310M200US15260","Brunswick, GA Metro Area","57780","1398",
"310M200US15380","Buffalo-Cheektowaga-Niagara Falls, NY Metro Area","520994","1022",
"310M200US15500","Burlington, NC Metro Area","68485","257",
"310M200US15540","Burlington-South Burlington, VT Metro Area","95152","560",
"310M200US15680","California-Lexington Park, MD Metro Area","43632","421",
"310M200US15940","Canton-Massillon, OH Metro Area","179323","493",
"310M200US15980","Cape Coral-Fort Myers, FL Metro Area","379060","849",
"310M200US16020","Cape Girardeau, MO-IL Metro Area","42494","889",
"310M200US16060","Carbondale-Marion, IL Metro Area","59565","663",
"310M200US16180","Carson City, NV Metro Area","23448","405",
"310M200US16220","Casper, WY Metro Area","36077","229",
"310M200US16300","Cedar Rapids, IA Metro Area","115304","530",
"310M200US16500","Centralia, WA Micro Area","34150","278",
"310M200US16540","Chambersburg-Waynesboro, PA Metro Area","64316","218",
"310M200US16580","Champaign-Urbana, IL Metro Area","104370","1175",
"310M200US16620","Charleston, WV Metro Area","108087","1259",
"310M200US16660","Charleston-Mattoon, IL Micro Area","28046","688",
"310M200US16700","Charleston-North Charleston, SC Metro Area","318493","933",
"310M200US16740","Charlotte-Concord-Gastonia, NC-SC Metro Area","989593","1051",
"310M200US16820","Charlottesville, VA Metro Area","101909","1769",
"310M200US16860","Chattanooga, TN-GA Metro Area","239343","1586",
"310M200US16940","Cheyenne, WY Metro Area","41960","226",
"310M200US16980","Chicago-Naperville-Elgin, IL-IN-WI Metro Area","3812007","1835",
"310M200US17020","Chico, CA Metro Area","98040","542",
"310M200US17060","Chillicothe, OH Micro Area","31750","379",
"310M200US17140","Cincinnati, OH-KY-IN Metro Area","922355","2108",
"310M200US17200","Claremont-Lebanon, NH-VT Micro Area","123255","569",
"310M200US17220","Clarksburg, WV Micro Area","42399","1012",
"310M200US17300","Clarksville, TN-KY Metro Area","115550","1160",
"310M200US17340","Clearlake, CA Micro Area","35697","235",
"310M200US17420","Cleveland, TN Metro Area","51038","978",
"310M200US17460","Cleveland-Elyria, OH Metro Area","957518","1397",
"310M200US17660","Coeur d'Alene, ID Metro Area","67022","401",
"310M200US17780","College Station-Bryan, TX Metro Area","102323","1569",
"310M200US17820","Colorado Springs, CO Metro Area","281288","990",
"310M200US17860","Columbia, MO Metro Area","74446","633",
"310M200US17900","Columbia, SC Metro Area","346611","1734",
"310M200US17980","Columbus, GA-AL Metro Area","131629","1252",
"310M200US18020","Columbus, IN Metro Area","33735","188",
"310M200US18140","Columbus, OH Metro Area","845563","1394",
"310M200US18180","Concord, NH Micro Area","63831","560",
"310M200US18260","Cookeville, TN Micro Area","49362","837",
"310M200US18300","Coos Bay, OR Micro Area","30481","204",
"310M200US18500","Corning, NY Micro Area","48774","294",
"310M200US18580","Corpus Christi, TX Metro Area","190036","1318",
"310M200US18700","Corvallis, OR Metro Area","37695","371",
"310M200US18880","Crestview-Fort Walton Beach-Destin, FL Metro Area","144261","608",
"310M200US18980","Cullman, AL Micro Area","37180","311",
"310M200US19060","Cumberland, MD-WV Metro Area","46250","911",
"310M200US19100","Dallas-Fort Worth-Arlington, TX Metro Area","2685922","1653",
"310M200US19140","Dalton, GA Metro Area","55375","306",
"310M200US19180","Danville, IL Metro Area","35941","334",
"310M200US19260","Danville, VA Micro Area","53713","349",
"310M200US19300","Daphne-Fairhope-Foley, AL Metro Area","108580","623",
"310M200US19340","Davenport-Moline-Rock Island, IA-IL Metro Area","168737","1042",
"310M200US19380","Dayton, OH Metro Area","367957","1136",
"310M200US19460","Decatur, AL Metro Area","66748","394",
"310M200US19500","Decatur, IL Metro Area","50307","449",
"310M200US19660","Deltona-Daytona Beach-Ormond Beach, FL Metro Area","307028","565",
"310M200US19740","Denver-Aurora-Lakewood, CO Metro Area","1132728","1743",
"310M200US19780","Des Moines-West Des Moines, IA Metro Area","258084","542",
"310M200US19820","Detroit-Warren-Dearborn, MI Metro Area","1895784","1138",
"310M200US20020","Dothan, AL Metro Area","68310","244",
"310M200US20100","Dover, DE Metro Area","68693","368",
"310M200US20180","DuBois, PA Micro Area","38593","425",
"310M200US20220","Dubuque, IA Metro Area","40589","354",
"310M200US20260","Duluth, MN-WI Metro Area","142158","967",
"310M200US20380","Dunn, NC Micro Area","49753","194",
"310M200US20500","Durham-Chapel Hill, NC Metro Area","235649","997",
"310M200US20700","East Stroudsburg, PA Metro Area","80718","324",
"310M200US20740","Eau Claire, WI Metro Area","71011","546",
"310M200US20940","El Centro, CA Metro Area","57229","344",
"310M200US21020","Elizabeth City, NC Micro Area","27593","1127",
"310M200US21060","Elizabethtown-Fort Knox, KY Metro Area","63708","1232",
"310M200US21140","Elkhart-Goshen, IN Metro Area","78023","489",
"310M200US21300","Elmira, NY Metro Area","38343","428",
"310M200US21340","El Paso, TX Metro Area","290930","613",
"310M200US21500","Erie, PA Metro Area","120096","714",
"310M200US21660","Eugene, OR Metro Area","159311","741",
"310M200US21700","Eureka-Arcata-Fortuna, CA Micro Area","62567","450",
"310M200US21780","Evansville, IN-KY Metro Area","140556","642",
"310M200US21820","Fairbanks, AK Metro Area","41627","448",
"310M200US22020","Fargo, ND-MN Metro Area","103691","472",
"310M200US22060","Faribault-Northfield, MN Micro Area","24624","542",
"310M200US22100","Farmington, MO Micro Area","29411","453",
"310M200US22140","Farmington, NM Metro Area","49659","281",
"310M200US22180","Fayetteville, NC Metro Area","164590","695",
"310M200US22220","Fayetteville-Springdale-Rogers, AR-MO Metro Area","209035","1458",
"310M200US22300","Findlay, OH Micro Area","33306","266",
"310M200US22380","Flagstaff, AZ Metro Area","64437","727",
"310M200US22420","Flint, MI Metro Area","190896","428",
"310M200US22500","Florence, SC Metro Area","89429","361",
"310M200US22520","Florence-Muscle Shoals, AL Metro Area","70686","392",
"310M200US22540","Fond du Lac, WI Metro Area","44625","321",
"310M200US22580","Forest City, NC Micro Area","33928","232",
"310M200US22660","Fort Collins, CO Metro Area","140887","888",
"310M200US22900","Fort Smith, AR-OK Metro Area","123523","580",
"310M200US23060","Fort Wayne, IN Metro Area","181528","563",
"310M200US23180","Frankfort, KY Micro Area","33301","754",
"310M200US23420","Fresno, CA Metro Area","326015","488",
"310M200US23460","Gadsden, AL Metro Area","47509","160",
"310M200US23540","Gainesville, FL Metro Area","121741","1369",
"310M200US23580","Gainesville, GA Metro Area","70098","191",
"310M200US23700","Gallup, NM Micro Area","25744","85",
"310M200US23900","Gettysburg, PA Metro Area","41454","322",
"310M200US24020","Glens Falls, NY Metro Area","68219","380",
"310M200US24060","Glenwood Springs, CO Micro Area","36639","1289",
"310M200US24140","Goldsboro, NC Metro Area","53289","373",
"310M200US24220","Grand Forks, ND-MN Metro Area","46960","488",
"310M200US24260","Grand Island, NE Metro Area","34997","404",
"310M200US24300","Grand Junction, CO Metro Area","64245","442",
"310M200US24340","Grand Rapids-Wyoming, MI Metro Area","410633","807",
"310M200US24420","Grants Pass, OR Metro Area","38145","281",
"310M200US24500","Great Falls, MT Metro Area","37932","384",
"310M200US24540","Greeley, CO Metro Area","102606","485",
"310M200US24580","Green Bay, WI Metro Area","141101","541",
"310M200US24620","Greeneville, TN Micro Area","32173","227",
"310M200US24640","Greenfield Town, MA Micro Area","33692","467",
"310M200US24660","Greensboro-High Point, NC Metro Area","329927","783",
"310M200US24780","Greenville, NC Metro Area","77329","428",
"310M200US24860","Greenville-Anderson-Mauldin, SC Metro Area","372542","911",
"310M200US24940","Greenwood, SC Micro Area","43195","888",
"310M200US25020","Guayama, PR Metro Area","36382","1470",
"310M200US25060","Gulfport-Biloxi-Pascagoula, MS Metro Area","176195","482",
"310M200US25180","Hagerstown-Martinsburg, MD-WV Metro Area","108148","527",
"310M200US25220","Hammond, LA Metro Area","53142","218",
"310M200US25260","Hanford-Corcoran, CA Metro Area","45251","549",
"310M200US25420","Harrisburg-Carlisle, PA Metro Area","246280","1082",
"310M200US25500","Harrisonburg, VA Metro Area","52901","571",
"310M200US25540","Hartford-West Hartford-East Hartford, CT Metro Area","508982","1113",
"310M200US25620","Hattiesburg, MS Metro Area","61904","931",
"310M200US25740","Helena, MT Micro Area","36227","601",
"310M200US25840","Hermiston-Pendleton, OR Micro Area","34116","655",
"310M200US25860","Hickory-Lenoir-Morganton, NC Metro Area","162285","864",
"310M200US25900","Hilo, HI Micro Area","86023","418",
"310M200US25940","Hilton Head Island-Bluffton-Beaufort, SC Metro Area","106442","977",
"310M200US25980","Hinesville, GA Metro Area","34902","1020",
"310M200US26020","Hobbs, NM Micro Area","25574","323",
"310M200US26090","Holland, MI Micro Area","50002","209",
"310M200US26140","Homosassa Springs, FL Metro Area","77726","351",
"310M200US26300","Hot Springs, AR Metro Area","50539","338",
"310M200US26380","Houma-Thibodaux, LA Metro Area","84864","588",
"310M200US26420","Houston-The Woodlands-Sugar Land, TX Metro Area","2502275","2119",
"310M200US26580","Huntington-Ashland, WV-KY-OH Metro Area","165093","1217",
"310M200US26620","Huntsville, AL Metro Area","192463","1013",
"310M200US26660","Huntsville, TX Micro Area","34343","1864",
"310M200US26740","Hutchinson, KS Micro Area","28302","435",
"310M200US26820","Idaho Falls, ID Metro Area","51115","447",
"310M200US26860","Indiana, PA Micro Area","38609","434",
"310M200US26900","Indianapolis-Carmel-Anderson, IN Metro Area","842013","1323",
"310M200US26980","Iowa City, IA Metro Area","69367","715",
"310M200US27060","Ithaca, NY Metro Area","42265","736",
"310M200US27100","Jackson, MI Metro Area","69023","461",
"310M200US27140","Jackson, MS Metro Area","239467","1927",
"310M200US27180","Jackson, TN Metro Area","56221","340",
"310M200US27260","Jacksonville, FL Metro Area","622796","1149",
"310M200US27340","Jacksonville, NC Metro Area","76912","448",
"310M200US27460","Jamestown-Dunkirk-Fredonia, NY Micro Area","66684","434",
"310M200US27500","Janesville-Beloit, WI Metro Area","68314","393",
"310M200US27620","Jefferson City, MO Metro Area","64148","902",
"310M200US27740","Johnson City, TN Metro Area","95781","1154",
"310M200US27780","Johnstown, PA Metro Area","65142","714",
"310M200US27860","Jonesboro, AR Metro Area","54902","401",
"310M200US27900","Joplin, MO Metro Area","76045","309",
"310M200US27980","Kahului-Wailuku-Lahaina, HI Metro Area","71839","332",
"310M200US28020","Kalamazoo-Portage, MI Metro Area","147143","721",
"310M200US28060","Kalispell, MT Micro Area","47501","245",
"310M200US28100","Kankakee, IL Metro Area","45182","723",
"310M200US28140","Kansas City, MO-KS Metro Area","890891","1339",
"310M200US28180","Kapaa, HI Micro Area","30476","153",
"310M200US28300","Keene, NH Micro Area","35016","405",
"310M200US28420","Kennewick-Richland, WA Metro Area","99751","619",
"310M200US28580","Key West, FL Micro Area","52979","406",
"310M200US28660","Killeen-Temple, TX Metro Area","171503","1324",
"310M200US28700","Kingsport-Bristol-Bristol, TN-VA Metro Area","147362","1160",
"310M200US28740","Kingston, NY Metro Area","83808","766",
"310M200US28900","Klamath Falls, OR Micro Area","32824","294",
"310M200US28940","Knoxville, TN Metro Area","389246","1248",
"310M200US29020","Kokomo, IN Metro Area","38748","311",
"310M200US29100","La Crosse-Onalaska, WI-MN Metro Area","58103","393",
"310M200US29180","Lafayette, LA Metro Area","204106","692",
"310M200US29200","Lafayette-West Lafayette, IN Metro Area","88739","1240",
"310M200US29300","LaGrange, GA Micro Area","28319","396",
"310M200US29340","Lake Charles, LA Metro Area","90582","832",
"310M200US29380","Lake City, FL Micro Area","28280","403",
"310M200US29420","Lake Havasu City-Kingman, AZ Metro Area","112850","459",
"310M200US29460","Lakeland-Winter Haven, FL Metro Area","284364","490",
"310M200US29540","Lancaster, PA Metro Area","207135","531",
"310M200US29620","Lansing-East Lansing, MI Metro Area","200399","706",
"310M200US29700","Laredo, TX Metro Area","79704","316",
"310M200US29740","Las Cruces, NM Metro Area","84640","319",
"310M200US29820","Las Vegas-Henderson-Paradise, NV Metro Area","871866","556",
"310M200US29860","Laurel, MS Micro Area","35789","1039",
"310M200US29940","Lawrence, KS Metro Area","48537","523",
"310M200US30020","Lawton, OK Metro Area","54704","608",
"310M200US30140","Lebanon, PA Metro Area","56479","323",
"310M200US30300","Lewiston, ID-WA Metro Area","27504","1058",
"310M200US30340","Lewiston-Auburn, ME Metro Area","49096","351",
"310M200US30460","Lexington-Fayette, KY Metro Area","216472","833",
"310M200US30620","Lima, OH Metro Area","44802","325",
"310M200US30700","Lincoln, NE Metro Area","133626","893",
"310M200US30780","Little Rock-North Little Rock-Conway, AR Metro Area","320504","1094",
"310M200US30860","Logan, UT-ID Metro Area","44286","570",
"310M200US30940","London, KY Micro Area","55108","1267",
"310M200US30980","Longview, TX Metro Area","89809","559",
"310M200US31020","Longview, WA Metro Area","43567","378",
"310M200US31080","Los Angeles-Long Beach-Anaheim, CA Metro Area","4585390","1924",
"310M200US31140","Louisville/Jefferson County, KY-IN Metro Area","549573","1826",
"310M200US31180","Lubbock, TX Metro Area","128772","974",
"310M200US31260","Lufkin, TX Micro Area","36312","422",
"310M200US31300","Lumberton, NC Micro Area","52231","290",
"310M200US31340","Lynchburg, VA Metro Area","115539","1212",
"310M200US31420","Macon, GA Metro Area","102735","1099",
"310M200US31460","Madera, CA Metro Area","50101","467",
"310M200US31540","Madison, WI Metro Area","278462","998",
"310M200US31700","Manchester-Nashua, NH Metro Area","168089","426",
"310M200US31740","Manhattan, KS Metro Area","39373","698",
"310M200US31820","Manitowoc, WI Micro Area","37200","256",
"310M200US31860","Mankato-North Mankato, MN Metro Area","40661","544",
"310M200US31900","Mansfield, OH Metro Area","54204","542",
"310M200US31940","Marinette, WI-MI Micro Area","44548","264",
"310M200US31980","Marion, IN Micro Area","30279","387",
"310M200US32020","Marion, OH Micro Area","27803","346",
"310M200US32100","Marquette, MI Micro Area","34555","323",
"310M200US32220","Marshall, TX Micro Area","28131","148",
"310M200US32300","Martinsville, VA Micro Area","32341","939",
"310M200US32420","Mayagüez, PR Metro Area","49515","1424",
"310M200US32580","McAllen-Edinburg-Mission, TX Metro Area","264607","498",
"310M200US32740","Meadville, PA Micro Area","44313","421",
"310M200US32780","Medford, OR Metro Area","92845","368",
"310M200US32820","Memphis, TN-MS-AR Metro Area","566812","1538",
"310M200US32900","Merced, CA Metro Area","84338","544",
"310M200US32940","Meridian, MS Micro Area","48492","1315",
"310M200US33100","Miami-Fort Lauderdale-West Palm Beach, FL Metro Area","2508362","1659",
"310M200US33140","Michigan City-La Porte, IN Metro Area","48768","613",
"310M200US33220","Midland, MI Metro Area","36465","191",
"310M200US33260","Midland, TX Metro Area","61462","529",
"310M200US33340","Milwaukee-Waukesha-West Allis, WI Metro Area","673012","1224",
"310M200US33460","Minneapolis-St. Paul-Bloomington, MN-WI Metro Area","1425844","1146",
"310M200US33500","Minot, ND Micro Area","37014","581",
"310M200US33540","Missoula, MT Metro Area","51865","426",
"310M200US33660","Mobile, AL Metro Area","182024","966",
"310M200US33700","Modesto, CA Metro Area","180748","379",
"310M200US33740","Monroe, LA Metro Area","79148","956",
"310M200US33780","Monroe, MI Metro Area","63643","163",
"310M200US33860","Montgomery, AL Metro Area","165532","868",
"310M200US33980","Morehead City, NC Micro Area","48985","178",
"310M200US34060","Morgantown, WV Metro Area","59602","893",
"310M200US34100","Morristown, TN Metro Area","50707","461",
"310M200US34180","Moses Lake, WA Micro Area","35635","106",
"310M200US34340","Mount Airy, NC Micro Area","33526","186",
"310M200US34380","Mount Pleasant, MI Micro Area","28739","344",
"310M200US34580","Mount Vernon-Anacortes, WA Metro Area","52216","341",
"310M200US34620","Muncie, IN Metro Area","52482","495",
"310M200US34740","Muskegon, MI Metro Area","73317","448",
"310M200US34780","Muskogee, OK Micro Area","30897","287",
"310M200US34820","Myrtle Beach-Conway-North Myrtle Beach, SC-NC Metro Area","279205","463",
"310M200US34860","Nacogdoches, TX Micro Area","28036","670",
"310M200US34900","Napa, CA Metro Area","55480","349",
"310M200US34940","Naples-Immokalee-Marco Island, FL Metro Area","206384","662",
"310M200US34980","Nashville-Davidson--Murfreesboro--Franklin, TN Metro Area","744743","1831",
"310M200US35100","New Bern, NC Metro Area","57959","1149",
"310M200US35260","New Castle, PA Micro Area","40672","286",
"310M200US35300","New Haven-Milford, CT Metro Area","362707","927",
"310M200US35380","New Orleans-Metairie, LA Metro Area","555769","1265",
"310M200US35420","New Philadelphia-Dover, OH Micro Area","39942","151",
"310M200US35620","New York-Newark-Jersey City, NY-NJ-PA Metro Area","7892766","2649",
"310M200US35660","Niles-Benton Harbor, MI Metro Area","76802","452",
"310M200US35840","North Port-Sarasota-Bradenton, FL Metro Area","414730","800",
"310M200US35900","North Wilkesboro, NC Micro Area","33017","180",
"310M200US35980","Norwich-New London, CT Metro Area","121660","377",
"310M200US36020","Oak Harbor, WA Micro Area","40854","360",
"310M200US36100","Ocala, FL Metro Area","163801","576",
"310M200US36140","Ocean City, NJ Metro Area","99005","597",
"310M200US36220","Odessa, TX Metro Area","57024","444",
"310M200US36260","Ogden-Clearfield, UT Metro Area","215344","694",
"310M200US36300","Ogdensburg-Massena, NY Micro Area","52250","827",
"310M200US36420","Oklahoma City, OK Metro Area","564489","1001",
"310M200US36460","Olean, NY Micro Area","40929","302",
"310M200US36500","Olympia-Tumwater, WA Metro Area","112535","562",
"310M200US36540","Omaha-Council Bluffs, NE-IA Metro Area","377960","880",
"310M200US36660","Opelousas, LA Micro Area","36265","139",
"310M200US36700","Orangeburg, SC Micro Area","42087","228",
"310M200US36740","Orlando-Kissimmee-Sanford, FL Metro Area","988969","1215",
"310M200US36780","Oshkosh-Neenah, WI Metro Area","74531","617",
"310M200US36860","Ottawa-Peru, IL Micro Area","68817","448",
"310M200US36980","Owensboro, KY Metro Area","50821","945",
"310M200US37020","Owosso, MI Micro Area","30018","217",
"310M200US37100","Oxnard-Thousand Oaks-Ventura, CA Metro Area","285889","487",
"310M200US37140","Paducah, KY-IL Micro Area","47550","1244",
"310M200US37260","Palatka, FL Micro Area","36525","480",
"310M200US37340","Palm Bay-Melbourne-Titusville, FL Metro Area","273134","431",
"310M200US37460","Panama City, FL Metro Area","109937","1074",
"310M200US37620","Parkersburg-Vienna, WV Metro Area","43659","658",
"310M200US37860","Pensacola-Ferry Pass-Brent, FL Metro Area","207635","1256",
"310M200US37900","Peoria, IL Metro Area","165966","833",
"310M200US37980","Philadelphia-Camden-Wilmington, PA-NJ-DE-MD Metro Area","2455550","2005",
"310M200US38060","Phoenix-Mesa-Scottsdale, AZ Metro Area","1860113","1458",
"310M200US38220","Pine Bluff, AR Metro Area","42522","772",
"310M200US38240","Pinehurst-Southern Pines, NC Micro Area","45719","173",
"310M200US38300","Pittsburgh, PA Metro Area","1107498","1872",
"310M200US38340","Pittsfield, MA Metro Area","68406","529",
"310M200US38460","Plattsburgh, NY Micro Area","35966","386",
"310M200US38540","Pocatello, ID Metro Area","33456","397",
"310M200US38660","Ponce, PR Metro Area","137693","2274",
"310M200US38820","Port Angeles, WA Micro Area","35873","285",
"310M200US38860","Portland-South Portland, ME Metro Area","267097","508",
"310M200US38900","Portland-Vancouver-Hillsboro, OR-WA Metro Area","960500","1327",
"310M200US38940","Port St. Lucie, FL Metro Area","217326","712",
"310M200US39020","Portsmouth, OH Micro Area","34140","423",
"310M200US39060","Pottsville, PA Micro Area","69126","561",
"310M200US39140","Prescott, AZ Metro Area","113085","593",
"310M200US39300","Providence-Warwick, RI-MA Metro Area","694169","852",
"310M200US39340","Provo-Orem, UT Metro Area","165983","830",
"310M200US39380","Pueblo, CO Metro Area","70142","411",
"310M200US39460","Punta Gorda, FL Metro Area","101781","640",
"310M200US39500","Quincy, IL-MO Micro Area","34357","489",
"310M200US39540","Racine, WI Metro Area","82334","626",
"310M200US39580","Raleigh, NC Metro Area","509680","1087",
"310M200US39660","Rapid City, SD Metro Area","63314","1245",
"310M200US39740","Reading, PA Metro Area","164907","1038",
"310M200US39820","Redding, CA Metro Area","78112","501",
"310M200US39900","Reno, NV Metro Area","191187","774",
"310M200US39980","Richmond, IN Micro Area","31162","288",
"310M200US40060","Richmond, VA Metro Area","521123","2864",
"310M200US40080","Richmond-Berea, KY Micro Area","43276","885",
"310M200US40140","Riverside-San Bernardino-Ontario, CA Metro Area","1538540","2041",
"310M200US40220","Roanoke, VA Metro Area","145389","1057",
"310M200US40260","Roanoke Rapids, NC Micro Area","36030","783",
"310M200US40340","Rochester, MN Metro Area","90304","353",
"310M200US40380","Rochester, NY Metro Area","475834","1274",
"310M200US40420","Rockford, IL Metro Area","145399","330",
"310M200US40580","Rocky Mount, NC Metro Area","67080","601",
"310M200US40660","Rome, GA Metro Area","40413","461",
"310M200US40700","Roseburg, OR Micro Area","49165","341",
"310M200US40740","Roswell, NM Micro Area","26691","392",
"310M200US40780","Russellville, AR Micro Area","35991","745",
"310M200US40900","Sacramento--Roseville--Arden-Arcade, CA Metro Area","889065","1103",
"310M200US40980","Saginaw, MI Metro Area","86824","600",
